R_SP,dR_SP,R_PP,dR_PP,Quotient,dQuotient,Quelle
0.055555556,0.001027778,0.057777778,0.001028889,0.961538462,0.024690464,Private Kommunikation mit Pavel Mimkes
0.03403,0.0001,0.02967,0.00026,1.146949781,0.01060085,Private Kommunikation mit Mark Kleineberg
0.010221533,0.000593677,0.006822615,0.000596828,1.498184054,0.157314935,Private Kommunikation mit Matias Ruiz
0.031632025,0.004410778,0.029086458,0.004724166,1.087517243,0.232797834,Private Kommunikation mit Merle Zimmermann
0.288560496,0.00114428,0.329533679,0.001164767,0.875663141,0.004651605,Private Kommunikation mit Lukas Schwager
0.702043796,0.001351022,0.740182648,0.001370091,0.948473728,0.002817279,Private Kommunikation mit Janek Musculus
